{
  "approval_digest": "6a26561df947335202e9a866dfdfd055aef919c166caa27025b5c83499619e29",
  "baseline": {
    "after_sha256": "c835580503c43bf0d34956ab877c24ccffe8abbcba7b2c3b80634795c6f53a7f",
    "before_sha256": "c835580503c43bf0d34956ab877c24ccffe8abbcba7b2c3b80634795c6f53a7f",
    "path": "/private/tmp/openapi-empirical-real-project-20260715/accepted",
    "unchanged": true
  },
  "contract": {
    "expected_sha256": "7d1e07b0c746ffdd36e8b607ebfd3469c18ead0ebfef4f09ca62641b6c18ea54",
    "observed_sha256": "7d1e07b0c746ffdd36e8b607ebfd3469c18ead0ebfef4f09ca62641b6c18ea54",
    "path": "/private/tmp/openapi-empirical-real-project-20260715/openapi.yaml",
    "verified": true
  },
  "decision": "proposed",
  "diff": null,
  "finished_at": "2026-07-15T14:10:16.610705Z",
  "fixture": {
    "expected_sha256": "bae2cc3d1f63a19bfcabeb4306ac81c87ba80c4935e1003642f1484cf528c137",
    "observed_sha256": "bae2cc3d1f63a19bfcabeb4306ac81c87ba80c4935e1003642f1484cf528c137",
    "path": "/private/tmp/openapi-empirical-real-project-20260715/fixtures/fixture.py",
    "verified": true
  },
  "gates": [
    {
      "command": [
        "java",
        "-Xmx512m",
        "-jar",
        "{artifact}",
        "validate",
        "-i",
        "{contract}"
      ],
      "dependency_install": false,
      "duration_ms": 0,
      "exit_code": null,
      "name": "validate",
      "network": false,
      "risk": "Execution requires exact approval.",
      "rollback": null,
      "status": "unverified",
      "stderr_sha256": null,
      "stdout_sha256": null,
      "summary": "Planned only."
    },
    {
      "command": [
        "java",
        "-Xmx512m",
        "-jar",
        "{previous_artifact}",
        "generate",
        "-i",
        "{contract}",
        "-g",
        "go",
        "-o",
        "{previous_output}",
        "--additional-properties=packageName=openapi,packageVersion=1.0.0"
      ],
      "dependency_install": false,
      "duration_ms": 0,
      "exit_code": null,
      "name": "generate-previous",
      "network": false,
      "risk": "Execution requires exact approval.",
      "rollback": null,
      "status": "unverified",
      "stderr_sha256": null,
      "stdout_sha256": null,
      "summary": "Planned only."
    },
    {
      "command": [],
      "dependency_install": false,
      "duration_ms": 0,
      "exit_code": null,
      "name": "baseline-match",
      "network": false,
      "risk": "Execution requires exact approval.",
      "rollback": null,
      "status": "unverified",
      "stderr_sha256": null,
      "stdout_sha256": null,
      "summary": "Planned only."
    },
    {
      "command": [
        "java",
        "-Xmx512m",
        "-jar",
        "{artifact}",
        "generate",
        "-i",
        "{contract}",
        "-g",
        "go",
        "-o",
        "{output}",
        "--additional-properties=packageName=openapi,packageVersion=1.0.0"
      ],
      "dependency_install": false,
      "duration_ms": 0,
      "exit_code": null,
      "name": "generate",
      "network": false,
      "risk": "Execution requires exact approval.",
      "rollback": "Discard the temporary output.",
      "status": "unverified",
      "stderr_sha256": null,
      "stdout_sha256": null,
      "summary": "Planned only."
    },
    {
      "command": [],
      "dependency_install": false,
      "duration_ms": 0,
      "exit_code": null,
      "name": "inventory-previous",
      "network": false,
      "risk": "Execution requires exact approval.",
      "rollback": null,
      "status": "unverified",
      "stderr_sha256": null,
      "stdout_sha256": null,
      "summary": "Planned only."
    },
    {
      "command": [],
      "dependency_install": false,
      "duration_ms": 0,
      "exit_code": null,
      "name": "inventory",
      "network": false,
      "risk": "Execution requires exact approval.",
      "rollback": null,
      "status": "unverified",
      "stderr_sha256": null,
      "stdout_sha256": null,
      "summary": "Planned only."
    },
    {
      "command": [],
      "dependency_install": false,
      "duration_ms": 0,
      "exit_code": null,
      "name": "diff",
      "network": false,
      "risk": "Execution requires exact approval.",
      "rollback": null,
      "status": "unverified",
      "stderr_sha256": null,
      "stdout_sha256": null,
      "summary": "Planned only."
    },
    {
      "command": [
        "go",
        "-C",
        "{previous_output}",
        "test",
        "-run",
        "^$",
        "."
      ],
      "dependency_install": true,
      "duration_ms": 0,
      "exit_code": null,
      "name": "compile-previous",
      "network": true,
      "risk": "Execution requires exact approval.",
      "rollback": null,
      "status": "unverified",
      "stderr_sha256": null,
      "stdout_sha256": null,
      "summary": "Planned only."
    },
    {
      "command": [
        "go",
        "-C",
        "{output}",
        "test",
        "-run",
        "^$",
        "."
      ],
      "dependency_install": true,
      "duration_ms": 0,
      "exit_code": null,
      "name": "compile",
      "network": true,
      "risk": "Execution requires exact approval.",
      "rollback": null,
      "status": "unverified",
      "stderr_sha256": null,
      "stdout_sha256": null,
      "summary": "Planned only."
    },
    {
      "command": [
        "/Users/zhichao/codex/openapi-generator/.venv/bin/python",
        "{fixture}",
        "{previous_output}"
      ],
      "dependency_install": true,
      "duration_ms": 0,
      "exit_code": null,
      "name": "fixture-previous",
      "network": true,
      "risk": "Execution requires exact approval.",
      "rollback": null,
      "status": "unverified",
      "stderr_sha256": null,
      "stdout_sha256": null,
      "summary": "Planned only."
    },
    {
      "command": [
        "/Users/zhichao/codex/openapi-generator/.venv/bin/python",
        "{fixture}",
        "{output}"
      ],
      "dependency_install": true,
      "duration_ms": 0,
      "exit_code": null,
      "name": "fixture",
      "network": true,
      "risk": "Execution requires exact approval.",
      "rollback": null,
      "status": "unverified",
      "stderr_sha256": null,
      "stdout_sha256": null,
      "summary": "Planned only."
    }
  ],
  "generator": {
    "artifact_sha256": "cb087e40001e31eb08ef6140dd5de10938dbeb89016a1fe0481eaa25cd569026",
    "maturity": "stable",
    "name": "openapi-generator-cli",
    "target": "go",
    "version": "7.23.0"
  },
  "inventory": null,
  "manifest_sha256": "6a26561df947335202e9a866dfdfd055aef919c166caa27025b5c83499619e29",
  "mode": "upgrade",
  "previous_generator": {
    "artifact_sha256": "3f1e6ce5c6ad4f15242c6170ab43aad4bad771622617eeece4a7d4f72ffaf329",
    "maturity": "stable",
    "name": "openapi-generator-cli",
    "target": "go",
    "version": "7.22.0"
  },
  "previous_inventory": null,
  "project": {
    "after_sha256": "6630c59be223c8e36799ae45c868b95382007ccc41c32be77d6d57136772bf02",
    "before_sha256": "6630c59be223c8e36799ae45c868b95382007ccc41c32be77d6d57136772bf02",
    "path": "/private/tmp/openapi-empirical-real-project-20260715",
    "unchanged": true
  },
  "report_version": 1,
  "risks": [
    "Commands have not run; no generator claim is verified."
  ],
  "rollback": [
    "Keep the accepted 7.22.0 output read-only and discard both temporary generations.",
    "Retain the 7.22.0 version pin until every 7.23.0 diff is explained and all gates pass.",
    "Delete /tmp/openapi-generator-tools-7.22.0 and /tmp/openapi-generator-tools-7.23.0 to remove downloaded artifacts."
  ],
  "started_at": "2026-07-15T14:10:16.610503Z",
  "status": "proposed",
  "unverified": [
    "validate",
    "generate-previous",
    "baseline-match",
    "generate",
    "inventory-previous",
    "inventory",
    "diff",
    "compile-previous",
    "compile",
    "fixture-previous",
    "fixture"
  ],
  "workspace": {
    "created": false,
    "reclaimed": true,
    "temporary": true
  }
}
